{
  "$schema": "https://json-schema.org/draft/2020-12/schema",
  "type": "object",
  "additionalProperties": false,
  "required": [
    "artifact_version",
    "task_id",
    "task_title",
    "mode",
    "current_step",
    "constraints",
    "active_rules",
    "recent_failures",
    "next_verification",
    "halt_conditions",
    "updated_at"
  ],
  "properties": {
    "artifact_version": {
      "const": "1"
    },
    "task_id": {
      "type": "string",
      "pattern": ".*\\S.*"
    },
    "task_title": {
      "type": "string",
      "pattern": ".*\\S.*"
    },
    "mode": {
      "enum": [
        "execute",
        "replan",
        "halted",
        "complete"
      ]
    },
    "current_step": {
      "type": "object",
      "additionalProperties": false,
      "required": [
        "id",
        "kind",
        "title",
        "files_expected",
        "verification_refs"
      ],
      "properties": {
        "id": {
          "type": "integer"
        },
        "kind": {
          "enum": [
            "edit",
            "docs"
          ]
        },
        "title": {
          "type": "string",
          "pattern": ".*\\S.*"
        },
        "files_expected": {
          "type": "array",
          "minItems": 1,
          "items": {
            "type": "string",
            "pattern": ".*\\S.*"
          }
        },
        "verification_refs": {
          "type": "array",
          "minItems": 1,
          "items": {
            "type": "string",
            "pattern": "^verification\\.(tests_run|logs|diffs|invariants|expected_behavior|actual_behavior)\\[[0-9]+\\]$"
          }
        }
      }
    },
    "constraints": {
      "type": "array",
      "minItems": 1,
      "items": {
        "type": "string",
        "pattern": ".*\\S.*"
      }
    },
    "active_rules": {
      "type": "array",
      "items": {
        "type": "string",
        "pattern": ".*\\S.*"
      }
    },
    "recent_failures": {
      "type": "array",
      "items": {
        "type": "object",
        "additionalProperties": false,
        "required": [
          "name",
          "subsystem",
          "code",
          "detail"
        ],
        "properties": {
          "name": {
            "enum": [
              "schema",
              "plan_lifecycle",
              "step_scope",
              "verification_refs",
              "explanation",
              "preconditions",
              "subagent",
              "rust",
              "odin",
              "abi",
              "abi_manifest",
              "abi_surface_report",
              "syscall_boundary_contract",
              "syscall_boundary_conformance",
              "syscall_table_contract",
              "syscall_class_contract",
              "syscall_table_conformance",
              "syscall_catalog",
              "syscall_surface_report",
              "governance_index_report",
              "protocol_contract_alignment",
              "layout_parity",
              "execution_foundation",
              "bridge_alignment",
              "runtime_trap_path",
              "runtime_smoke_evidence",
              "runtime_evidence_review",
              "runtime_evidence_taxonomy",
              "runtime_halt_contract",
              "runtime_progression_contract",
              "runtime_progression_entry_contract",
              "runtime_progression_evidence",
              "runtime_progression_stages",
              "stack_initialization_evidence_contract",
              "stack_initialization_evidence",
              "memory_initialization_evidence_contract",
              "memory_initialization_evidence",
              "controlled_runtime_loop_contract",
              "controlled_runtime_loop_evidence",
              "first_governed_runtime_capability",
              "first_governed_runtime_capability_evidence",
              "cpu_extended_state_initialization_contract",
              "cpu_extended_state_initialization_evidence",
              "boot_blocker_report",
              "boot_protocol_decision",
              "boot_image_skeleton",
              "boot_image_packaging",
              "boot_tooling",
              "kernel_loadability",
              "host_dependency_portability",
              "qemu_smoke_evidence",
              "return_path_proof",
              "execution_proof",
              "validator_coverage",
              "evidence"
            ]
          },
          "subsystem": {
            "enum": [
              "schema",
              "lifecycle",
              "step_scope",
              "verification_refs",
              "explanation",
              "preconditions",
              "subagent",
              "rust",
              "odin",
              "abi",
              "abi_manifest",
              "abi_surface_report",
              "syscall_boundary_contract",
              "syscall_boundary_conformance",
              "syscall_table_contract",
              "syscall_class_contract",
              "syscall_table_conformance",
              "syscall_catalog",
              "syscall_surface_report",
              "governance_index_report",
              "protocol_contract_alignment",
              "structural_integrity",
              "execution_foundation",
              "bridge_alignment",
              "runtime_trap_path",
              "runtime_smoke_evidence",
              "runtime_evidence_review",
              "runtime_evidence_taxonomy",
              "runtime_halt_contract",
              "runtime_progression_contract",
              "runtime_progression_entry_contract",
              "runtime_progression_evidence",
              "runtime_progression_stages",
              "stack_initialization_evidence_contract",
              "stack_initialization_evidence",
              "memory_initialization_evidence_contract",
              "memory_initialization_evidence",
              "controlled_runtime_loop_contract",
              "controlled_runtime_loop_evidence",
              "first_governed_runtime_capability",
              "first_governed_runtime_capability_evidence",
              "cpu_extended_state_initialization_contract",
              "cpu_extended_state_initialization_evidence",
              "boot_blocker_report",
              "boot_protocol_decision",
              "boot_image_skeleton",
              "boot_image_packaging",
              "boot_tooling",
              "kernel_loadability",
              "host_dependency_portability",
              "qemu_smoke_evidence",
              "return_path_proof",
              "execution_proof",
              "validator_coverage",
              "evidence"
            ]
          },
          "code": {
            "type": "string",
            "pattern": ".*\\S.*"
          },
          "sub_results": {
            "type": "array",
            "items": {
              "type": "object",
              "additionalProperties": false,
              "required": [
                "name",
                "status",
                "detail"
              ],
              "properties": {
                "name": {
                  "type": "string",
                  "pattern": ".*\\S.*"
                },
                "status": {
                  "enum": [
                    "pass",
                    "fail"
                  ]
                },
                "detail": {
                  "type": "string",
                  "pattern": ".*\\S.*"
                }
              }
            }
          },
          "detail": {
            "type": "string",
            "pattern": ".*\\S.*"
          },
          "action": {
            "type": "string",
            "pattern": ".*\\S.*"
          },
          "action_code": {
            "type": "string",
            "pattern": ".*\\S.*"
          }
        }
      }
    },
    "next_verification": {
      "type": "array",
      "items": {
        "type": "string",
        "pattern": "^verification\\.(tests_run|logs|diffs|invariants|expected_behavior|actual_behavior)\\[[0-9]+\\]$"
      }
    },
    "halt_conditions": {
      "type": "array",
      "minItems": 1,
      "items": {
        "type": "string",
        "pattern": ".*\\S.*"
      }
    },
    "updated_at": {
      "type": "string",
      "pattern": "^\\d{4}-\\d{2}-\\d{2}T\\d{2}:\\d{2}:\\d{2}Z$"
    }
  }
}
